类型,轮次,query,plan,reply,assistant,app,大类,origin_instruct,责任人,tag,,,,,,,,,,,,,
单轮-单任务,1,在天猫的屈臣氏旗舰店，搜搜曼秀雷敦唇膏行不​,在$天猫$中屈臣氏旗舰店店铺内搜索曼秀雷敦唇膏​,完成,好的,天猫,打开,在天猫中<店铺名>店铺内搜索<搜索内容>,,,,,,,,,,,,,,,
单轮-单任务,1,帮我打开下天猫的丝芙兰旗舰店彩妆类别页面,在$天猫$中打开丝芙兰旗舰店店铺的彩妆类别​,完成,好的,天猫,打开,在天猫中打开<店铺名>店铺的<类别>类别,,,,,,,,,,,,,,,
单轮-单任务,1,花西子最近很火啊，帮我关注下​天猫上的花西子官方店,在$天猫$中关注花西子官方店店铺​,完成,好的,天猫,收藏,在天猫中关注<店铺名>店铺,,,,,,,,,,,,,,,
单轮-单任务,1,天猫收藏夹里的稚优泉唇釉，帮我删了呗​,在$天猫$中删除收藏夹中的稚优泉唇釉​,完成,好的,天猫,收藏,在天猫中删除收藏夹中的<搜索内容>,,,,,,,,,,,,,,,
单轮-单任务,1,在天猫搜搜苹果手表，挑个45毫米的行不​,在$天猫$中搜索苹果手表筛选45毫米​,完成,好的,天猫,搜索,在天猫中搜索<搜索内容>筛选<筛选条件>,,,,,,,,,,,,,,,
单轮-单任务,1,我在天猫买的戴森吹风机，帮我看看物流单号哈​,在$天猫$中查看戴森吹风机订单的物流单号​,完成,好的,天猫,物流,在天猫中查看<搜索内容>订单的物流单号,,,,,,,,,,,,,,,
单轮-单任务,1,YOYO，天猫上买的百草味饼干，快递电话帮我找下呗,在$天猫$中拨打百草味饼干订单的快递电话,完成,好的,天猫,物流,在天猫中拨打<搜索内容>订单的快递电话,,,,,,,,,,,,,,,
单轮-单任务,1,帮我催下发货呗​，天猫上兰蔻粉底液订单,在$天猫$中给兰蔻粉底液订单催发货​,完成,好的,天猫,物流,在天猫中给<搜索内容>订单催发货,,,,,,,,,,,,,,,
单轮-单任务,1,天猫里买的小米扫地机器人订单，催下配送行不​,在$天猫$中给小米扫地机器人订单催配送​,完成,好的,天猫,物流,在天猫中给<搜索内容>订单催配送,,,,,,,,,,,,,,,
单轮-单任务,1,确认下收货哈​，天猫中我买的Nike运动鞋订单,在$天猫$中给Nike运动鞋订单确认收货​,完成,好的,天猫,物流,在天猫中给<搜索内容>订单确认收货,,,,,,,,,,,,,,,
单轮-单任务,1,天猫上买的华为平板订单，帮我申请售后呗​,在$天猫$中给华为平板订单申请售后​,完成,好的,天猫,订单,在天猫中给<搜索内容>订单申请售后,,,,,,,,,,,,,,,
单轮-单任务,1,这面膜用着过敏啊，赶紧帮我申请退货，天猫里的资生堂面霜订单,在$天猫$中给资生堂面霜订单申请退货且原因为过敏​,完成,好的,天猫,订单,在天猫中给<搜索内容>订单申请<售后类型>且原因为<原因>,,,,,,,,,,,,,,,
单轮-单任务,1,帮我评价一下天猫上买的百雀羚水乳订单,在$天猫$中评价百雀羚水乳订单​,完成,好的,天猫,订单,在天猫中评价<搜索内容>订单,,,,,,,,,,,,,,,
单轮-单任务,1,悠悠，天猫中买的完美日记眼影订单，评价给个五星,在$天猫$中评价完美日记眼影订单且星级为五星​,完成,好的,天猫,评价,在天猫中评价<搜索内容>订单且星级为<星级>,,,,,,,,,,,,,,,
单轮-单任务,1,稚优泉唇釉颜色很正啊，也很显白，帮我评价下吧，天猫里买的稚优泉唇釉订单​,在$天猫$中评价稚优泉唇釉订单且评价内容为颜色很正，很显白,完成,好的,天猫,评价,在天猫中评价<搜索内容>订单且评价内容为<文本内容>,,,,,,,,,,,,,,,
单轮-单任务,1,天猫上买的韩束面膜订单，评价时帮我上传图片呗​,在$天猫$中评价韩束面膜订单并上传图片​,完成,好的,天猫,评价,在天猫中评价<搜索内容>订单并上传图片,,,,,,,,,,,,,,,
单轮-单任务,1,天猫中买的自然堂洗面奶订单，评价给四星，内容写清洁力不错，再上传下图片,在$天猫$中评价自然堂洗面奶订单，星级为四星，评价内容为清洁力不错，并上传图片​,完成,好的,天猫,评价,在天猫中评价<搜索内容>订单，星级为<星级>，评价内容为<文本内容>，并上传图片,,,,,,,,,,,,,,,
单轮-单任务,1,上次闲鱼上我买的二手Kindle订单，帮我看看物流单号哈​,在$闲鱼$中查看二手Kindle订单的物流单号​,完成,好的,闲鱼,物流,在闲鱼中查看<搜索内容>订单的物流单号,,,,,,,,,,,,,,,
单轮-单任务,1,对了，我在闲鱼里买的复古相机，订单的快递电话号码能找到吗,在$闲鱼$中查看复古相机订单的快递电话​,完成,好的,闲鱼,物流,在闲鱼中查看<搜索内容>订单的快递电话,,,,,,,,,,,,,,,
单轮-单任务,1,麻烦你在闲鱼上看看，我买的手工钱包订单，能不能催下发货呀,在$闲鱼$中给手工钱包订单催发货​,完成,好的,闲鱼,物流,在闲鱼中给<搜索内容>订单催发货,,,,,,,,,,,,,,,
单轮-单任务,1,闲鱼里我买的明星海报订单，帮忙催下配货行不行哦,在$闲鱼$中给明星海报订单催配货​,完成,好的,闲鱼,物流,在闲鱼中给<搜索内容>订单催配货,,,,,,,,,,,,,,,
单轮-单任务,1,我在闲鱼中买的旧书订单，估计到了，帮我确认收货哈,在$闲鱼$中给旧书订单确认收货,完成,好的,闲鱼,物流,在闲鱼中给<搜索内容>订单确认收货,,,,,,,,,,,,,,,
单轮-单任务,1,你能不能帮我在闲鱼上，为我买的二手吉他订单申请售后呀,在$闲鱼$中给二手吉他订单申请售后​,完成,好的,闲鱼,订单,在闲鱼中给<搜索内容>订单申请售后,,,,,,,,,,,,,,,
单轮-单任务,1,在闲鱼里买的复古连衣裙，订单想申请换货，原因是尺寸不符，能弄吗,在$闲鱼$中给复古连衣裙订单申请换货且原因为尺寸不符​,完成,好的,闲鱼,订单,在闲鱼中给<搜索内容>订单申请<售后类型>且原因为<原因>,,,,,,,,,,,,,,,
单轮-单任务,1,帮我给在闲鱼上买的旧款相机订单评价一下,在$闲鱼$中评价旧款相机订单​,完成,好的,闲鱼,订单,在闲鱼中评价<搜索内容>订单,,,,,,,,,,,,,,,
单轮-单任务,1,我在闲鱼中买的二手textbooks订单，评价的时候给个四星，可以吗,在$闲鱼$中评价二手textbooks订单且星级为四星​,完成,好的,闲鱼,评价,在闲鱼中评价<搜索内容>订单且星级为<星级>,,,,,,,,,,,,,,,
单轮-单任务,1,在闲鱼里买的手工钥匙扣，订单评价内容就写做工精致，很喜欢哦,在$闲鱼$中评价手工钥匙扣订单且评价内容为做工精致，很喜欢,完成,好的,闲鱼,评价,在闲鱼中评价<搜索内容>订单且评价内容为<文本内容>,,,,,,,,,,,,,,,
单轮-单任务,1,评价我在闲鱼上买的闲置背包订单时，帮我上传图片哈,在$闲鱼$中评价闲置背包订单并上传图片​,完成,好的,闲鱼,评价,在闲鱼中评价<搜索内容>订单并上传图片,,,,,,,,,,,,,,,
单轮-单任务,1,对于在闲鱼中买的二手运动鞋订单，评价给五星，内容写九成新，穿着舒服，再上传下图片,在$闲鱼$中评价二手运动鞋订单，星级为五星，评价内容为九成新，穿着舒服，并上传图片​,完成,好的,闲鱼,评价,在闲鱼中评价<搜索内容>订单，星级为<星级>，评价内容为<文本内容>，并上传图片,,,,,,,,,,,,,,,
单轮-单任务,1,能麻烦你在闲鱼上帮我搜搜二手任天堂Switch呗,在$闲鱼$中搜索二手任天堂Switch​,完成,好的,闲鱼,打开,在闲鱼中搜索<搜索内容>,,,,,,,,,,,,,,,
单轮-单任务,1,闲鱼里那个闲置的Kindle Paperwhite，帮我下下单,在$闲鱼$中下单闲置的Kindle Paperwhite​,完成,好的,闲鱼,下单,在闲鱼中下单<搜索内容>,,,,,,,,,,,,,,,
单轮-单任务,1,悠悠，我想在闲鱼上买个二手跑步机，送到北京市朝阳区建国路88号,在$闲鱼$中下单二手跑步机送至北京市朝阳区建国路88号​,完成,好的,闲鱼,下单,在闲鱼中下单<搜索内容>送至<地址>,,,,,,,,,,,,,,,
单轮-单任务,1,麻烦帮我用支付宝下下单，闲鱼里有个闲置的无人机,在$闲鱼$中用支付宝下单闲置的无人机​,完成,好的,闲鱼,下单,在闲鱼中用<支付方式>下单<搜索内容>,,,,,,,,,,,,,,,
单轮-单任务,1,我打算在闲鱼上买2个16G的二手U盘，用微信支付下单，送到上海市静安区南京西路1266号哦,在$闲鱼$中下单2个16G的二手U盘用微信支付送至上海市静安区南京西路1266号​,完成,好的,闲鱼,下单,在闲鱼中下单<数量><规格>的<搜索内容>用<支付方式>送至<地址>,,,,,,,,,,,,,,,
单轮-单任务,1,刚在闲鱼上看到个复古海报，还挺好看，帮我收藏一下哈,在$闲鱼$中收藏复古海报,完成,好的,闲鱼,收藏,在闲鱼中收藏<搜索内容>,,,,,,,,,,,,,,,
单轮-单任务,1,yoyo，你在闲鱼上搜搜二手笔记本电脑，然后筛选出降价的,在$闲鱼$中搜索二手笔记本电脑并筛选降价​,完成,好的,闲鱼,搜索,在闲鱼中搜索<搜索内容>并筛选降价,,,,,,,,,,,,,,,
单轮-单任务,1,在闲鱼里，帮我搜下闲置化妆品，把那些新发的筛选出来哦,在$闲鱼$中搜索闲置化妆品并筛选新发​,完成,好的,闲鱼,搜索,在闲鱼中搜索<搜索内容>并筛选新发,,,,,,,,,,,,,,,
单轮-单任务,1,我最近想在闲鱼里买台二手自行车，帮我搜索下并把筛选出广州市,在$闲鱼$中搜索二手自行车并筛选广州市​,完成,好的,闲鱼,搜索,在闲鱼中搜索<搜索内容>并筛选<区域>,,,,,,,,,,,,,,,
单轮-单任务,1,在闲鱼上搜一下复古手表并筛选出九成新及以上的,在$闲鱼$中搜索复古手表并筛选九成新及以上,完成,好的,闲鱼,搜索,在闲鱼中搜索<搜索内容>并筛选<筛选条件>,,,,,,,,,,,,,,,
单轮-单任务,1,家里灯泡坏了，帮我在抖音火山版的商城里打开下欧普LED灯泡,在$抖音火山版$中打开商城中的欧普LED灯泡​,完成,好的,抖音火山版,打开,在抖音火山版的商城中打开<搜索内容>,,,,,,,,,,,,,,,
单轮-单任务,1,听说最近完美日记眼影盘很火，帮我在抖音火山版商城中打开下评论详情页,在$抖音火山版$中打开商城中的完美日记眼影盘的评论​,完成,好的,抖音火山版,打开,在抖音火山版的商城中打开<搜索内容>的评论,,,,,,,,,,,,,,,
单轮-单任务,1,对了，抖音火山版商城里的华为耳机，规格帮我瞅瞅哈,在$抖音火山版$中打开商城中华为耳机的规格​,完成,好的,抖音火山版,打开,在抖音火山版的商城中打开<搜索内容>的规格,,,,,,,,,,,,,,,
单轮-单任务,1,看下抖音火山版的商城中有小米充电宝吗，顺便帮我看下参数,在$抖音火山版$中打开商城中小米充电宝的参数​,完成,好的,抖音火山版,打开,在抖音火山版的商城中打开<搜索内容>的参数,,,,,,,,,,,,,,,
单轮-单任务,1,打开下抖音火山版商城里的九阳榨汁机的详情页,在$抖音火山版$中打开商城中九阳榨汁机的详情​,完成,好的,抖音火山版,打开,在抖音火山版的商城中打开<搜索内容>的详情,,,,,,,,,,,,,,,
单轮-单任务,1,抖音火山版商城中的三只松鼠坚果礼盒，查看送到武汉市武昌区中北路108号的时间行不​,在$抖音火山版$中的商城查看三只松鼠坚果礼盒送达武汉市武昌区中北路108号的时间​,完成,好的,抖音火山版,搜索,在抖音火山版的商城中查看<搜索内容>送达<地址>的时间,,,,,,,,,,,,,,,
单轮-单任务,1,帮我在抖音火山版商城里加入6包抽纸到购物车,在$抖音火山版$中的商城把6包抽纸加入​购物车,完成,好的,抖音火山版,购物车,在抖音火山版的商城中加入购物车<数量>的<搜索内容>,,,,,,,,,,,,,,,
单轮-单任务,1,看看L码的森马卫衣抖音火山版商城中有吗，加到购物车里,在$抖音火山版$中的商城把L码的森马卫衣​加入购物车,完成,好的,抖音火山版,购物车,在抖音火山版的商城中加入购物车<规格>的<搜索内容>,,,,,,,,,,,,,,,
单轮-单任务,1,hi，麻烦把抖音火山版商城里的2瓶装的30ml兰蔻粉水，加入购物车并送到成都市锦江区红星路一段15号,在$抖音火山版$中的商城把加入购物车的2瓶30ml规格兰蔻粉水送至成都市锦江区红星路一段15号​,完成,好的,抖音火山版,购物车,在抖音火山版的商城中加入购物车<规格><数量>的<搜索内容>送至<地址>,,,,,,,,,,,,,,,
单轮-单任务,1,悠悠，帮我把抖音火山版商城中的美的电饭煲，加入购物车并送到广州市天河区天河路385号,在$抖音火山版$中的商城把加入购物车的美的电饭煲送至广州市天河区天河路385号​,完成,好的,抖音火山版,购物车,在抖音火山版的商城中加入购物车<搜索内容>送至<地址>,,,,,,,,,,,,,,,
单轮-单任务,1,抖音火山版商城里的妮维雅沐浴露，加入下购物车,在$抖音火山版$中的商城把妮维雅沐浴露​加入购物车,完成,好的,抖音火山版,购物车,在抖音火山版的商城中加入购物车<搜索内容>,,,,,,,,,,,,,,,
单轮-单任务,1,帮我在抖音火山版商城中下一下单，珀莱雅双抗精华,在$抖音火山版$中的商城下单珀莱雅双抗精华​,完成,好的,抖音火山版,下单,在抖音火山版的商城中下单<搜索内容>,,,,,,,,,,,,,,,
单轮-单任务,1,抖音火山版商城里的100ml的理肤泉B5，下下单,在$抖音火山版$中的商城下单100ml的理肤泉B5​,完成,好的,抖音火山版,下单,在抖音火山版的商城中下单<规格>的<搜索内容>,,,,,,,,,,,,,,,
单轮-单任务,1,想喝牛奶了，帮我在抖音火山版商城中下单4罐旺仔牛奶,在$抖音火山版$中的商城下单4罐的旺仔牛奶​,完成,好的,抖音火山版,下单,在抖音火山版的商城中下单<数量>的<搜索内容>,,,,,,,,,,,,,,,
单轮-单任务,1,抖音火山版商城里的苏泊尔电炖锅，下下单并送到上海市静安区南京西路1266号,在$抖音火山版$中的商城下单苏泊尔电炖锅送至上海市静安区南京西路1266号​,完成,好的,抖音火山版,下单,在抖音火山版的商城中下单<搜索内容>送至<地址>,,,,,,,,,,,,,,,
单轮-单任务,1,微信没钱了，帮我用支付宝在抖音火山版商城中下单耐克运动鞋,在$抖音火山版$中的商城用支付宝下单耐克运动鞋​,完成,好的,抖音火山版,下单,在抖音火山版的商城中用<支付方式>下单<搜索内容>,,,,,,,,,,,,,,,
单轮-单任务,1,抖音火山版商城里的2支3.5g的迪奥999口红，用花呗下单送到杭州市西湖区文二路328号呗​,在$抖音火山版$中的商城下单2支3.5g的迪奥999口红用花呗支付送至杭州市西湖区文二路328号​,完成,好的,抖音火山版,下单,在抖音火山版的商城中下单<数量><规格>的<搜索内容>用<支付方式>送至<地址>,,,,,,,,,,,,,,,
单轮-单任务,1,收藏下抖音火山版商城中的玉泽皮肤屏障修复乳,在$抖音火山版$中的商城收藏玉泽皮肤屏障修复乳​,完成,好的,抖音火山版,收藏,在抖音火山版的商城中收藏<搜索内容>,,,,,,,,,,,,,,,
单轮-单任务,1,看下抖音火山版商城中的国家补贴，搜搜薇诺娜特护霜有补贴吗,在$抖音火山版$中打开商城的国家补贴并搜索薇诺娜特护霜​,完成,好的,抖音火山版,搜索,在抖音火山版中打开商城的国家补贴并搜索<搜索内容>,,,,,,,,,,,,,,,
单轮-单任务,1,搜搜抖音火山版中商城直播中的花西子眉笔呗​,在$抖音火山版$中搜索商城直播中的花西子眉笔​,完成,好的,抖音火山版,搜索,在抖音火山版中搜索商城直播中的<搜索内容>,,,,,,,,,,,,,,,
单轮-单任务,1,麻烦帮我打开下抖音火山版商城里的韩束官方旗舰店,在$抖音火山版$中的商城打开韩束官方旗舰店店铺​,完成,好的,抖音火山版,打开,在抖音火山版中打开商城中的<店铺名>店铺,,,,,,,,,,,,,,,
单轮-单任务,1,YOYO，帮我在抖音火山版商城中的百雀羚旗舰店搜索下甘油一号,在$抖音火山版$中的商城中百雀羚旗舰店店铺内搜索甘油一号​,完成,好的,抖音火山版,打开,在抖音火山版中商城中的<店铺名>店铺内搜索<搜索内容>,,,,,,,,,,,,,,,
单轮-单任务,1,抖音火山版商城里的自然堂旗舰店，打开下彩妆类别,在$抖音火山版$中打开商城中的自然堂旗舰店店铺的彩妆类别​,完成,好的,抖音火山版,打开,在抖音火山版中打开商城中的<店铺名>店铺的<类别>类别,,,,,,,,,,,,,,,
单轮-单任务,1,帮我关注一下​抖音火山版商城中的相宜本草官方旗舰店,在$抖音火山版$中关注商城中的相宜本草官方旗舰店店铺​,完成,好的,抖音火山版,收藏,在抖音火山版中关注商城中的<店铺名>店铺,,,,,,,,,,,,,,,
单轮-单任务,1,抖音火山版中，搜搜商城特价里的馥蕾诗红茶睡眠面膜,在$抖音火山版$中搜索商城特价中的馥蕾诗红茶睡眠面膜​,完成,好的,抖音火山版,搜索,在抖音火山版中搜索商城特价中的<搜索内容>,,,,,,,,,,,,,,,
单轮-单任务,1,没纸用了，YOYO，在抖音火山版商城小时达里搜下清风卷纸,在$抖音火山版$中搜索商城小时达中的清风卷纸​,完成,好的,抖音火山版,搜索,在抖音火山版中搜索商城小时达中的<搜索内容>,,,,,,,,,,,,,,,
单轮-单任务,1,想换新手机了，找下抖音火山版商城中的苹果15内存256G的,在$抖音火山版$中的商城搜索苹果15筛选内存256G​,完成,好的,抖音火山版,搜索,在抖音火山版中搜索商城中的<搜索内容>筛选<筛选条件>,,,,,,,,,,,,,,,
单轮-单任务,1,赶紧帮我查下抖音火山版商城里的飞利浦电动牙刷订单的物流单号,在$抖音火山版$中查看商城飞利浦电动牙刷订单的物流单号​,完成,好的,抖音火山版,物流,在抖音火山版中查看商城<搜索内容>订单的物流单号,,,,,,,,,,,,,,,
单轮-单任务,1,悠悠，可以帮我拨打下抖音火山版商城中的百草味饼干订单的电话号吗,在$抖音火山版$中拨打商城中的百草味饼干订单的快递电话​,完成,好的,抖音火山版,物流,在抖音火山版中拨打商城<搜索内容>订单的快递电话,,,,,,,,,,,,,,,
单轮-单任务,1,帮我催一下货吧，抖音火山版商城里的兰蔻小黑瓶订单,在$抖音火山版$中给商城中的兰蔻小黑瓶订单催发货​,完成,好的,抖音火山版,物流,在抖音火山版中给商城<搜索内容>订单催发货,,,,,,,,,,,,,,,
单轮-单任务,1,帮我在抖音火山版商城中的美的洗衣机订单催下配送,在$抖音火山版$中给商城中的美的洗衣机订单催配送​,完成,好的,抖音火山版,物流,在抖音火山版中给商城<搜索内容>订单催配送,,,,,,,,,,,,,,,
单轮-单任务,1,优衣库羽绒服真不错，帮我确认下收货，抖音火山版商城里的优衣库羽绒服订单,在$抖音火山版$中给商城中的给优衣库羽绒服订单确认收货​,完成,好的,抖音火山版,物流,在抖音火山版中给商城<搜索内容>订单确认收货,,,,,,,,,,,,,,,
单轮-单任务,1,红腰子不行啊，帮我在申请一下售后呗，抖音火山版商城中的资生堂红腰子订单​,在$抖音火山版$中给商城中德资生堂红腰子订单申请售后​,完成,好的,抖音火山版,订单,在抖音火山版中给商城<搜索内容>订单申请售后,,,,,,,,,,,,,,,
单轮-单任务,1,连衣裙尺码不合适啊，帮我退一下货，抖音火山版商城里的ZARA连衣裙订单,在$抖音火山版$中给商城中的ZARA连衣裙订单申请退货且原因为尺码不合适​,完成,好的,抖音火山版,订单,在抖音火山版中给商城<搜索内容>订单申请<售后类型>且原因为<原因>,,,,,,,,,,,,,,,
单轮-单任务,1,抖音火山版商城中的完美日记动物眼影盘订单，帮我评价一下哈​,在$抖音火山版$中评价商城中的完美日记动物眼影盘订单​,完成,好的,抖音火山版,评价,在抖音火山版中评价商城<搜索内容>订单,,,,,,,,,,,,,,,
单轮-单任务,1,帮我给抖音火山版商城里的YSL小金条订单五星好评,在$抖音火山版$中评价商城中的YSL小金条订单且星级为五星​,完成,好的,抖音火山版,评价,在抖音火山版中评价商城<搜索内容>订单且星级为<星级>,,,,,,,,,,,,,,,
单轮-单任务,1,保湿乳保湿效果很好啊，帮我评价下抖音火山版商城中的珂润保湿乳订单,在$抖音火山版$中评价商城中的珂润保湿乳订单且评价内容为保湿效果很好,完成,好的,抖音火山版,评价,在抖音火山版中评价商城<搜索内容>订单且评价内容为<文本内容>,,,,,,,,,,,,,,,
单轮-单任务,1,抖音火山版商城里的韩束面膜订单，评价时上传下图片,在$抖音火山版$中评价商城中德韩束面膜订单并上传图片​,完成,好的,抖音火山版,评价,在抖音火山版中评价商城<搜索内容>订单并上传图片,,,,,,,,,,,,,,,
单轮-单任务,1,抖音火山版商城中的自然堂洗面奶订单，评价给四星，内容写清洁力不错，再上传下图片,在$抖音火山版$中评价商城中的自然堂洗面奶订单，星级为四星，评价内容为“清洁力不错”，并上传图片,完成,好的,抖音火山版,评价,在抖音火山版中评价商城<搜索内容>订单，星级为<星级>，评价内容为<文本内容>，并上传图片,,,,,,,,,,,,,,,
单轮-单任务,1,YOYO，麻烦帮我把阿里巴巴收藏的一次性纸杯​删除下,在$阿里巴巴$中删除收藏中的一次性纸杯​,完成,好的,阿里巴巴,收藏,在阿里巴巴中删除收藏中的<搜索内容>,,,,,,,,,,,,,,,
单轮-单任务,1,嘿，YOYO，在阿里巴巴上搜下纯棉T恤​,在$阿里巴巴$中搜索纯棉T恤​,完成,好的,阿里巴巴,搜索,在阿里巴巴中搜索<搜索内容>,,,,,,,,,,,,,,,
单轮-单任务,1,看下阿里巴巴的不锈钢保温杯评论区,在$阿里巴巴$中打开不锈钢保温杯的评论​,完成,好的,阿里巴巴,打开,在阿里巴巴中打开<搜索内容>的评论,,,,,,,,,,,,,,,
单轮-单任务,1,看看阿里巴巴大号收纳箱的规格​详情页,在$阿里巴巴$中打开大号收纳箱的规格​,完成,好的,阿里巴巴,打开,在阿里巴巴中打开<搜索内容>的规格,,,,,,,,,,,,,,,
单轮-单任务,1,哎，想看下阿里巴巴智能手环的参数详情页,在$阿里巴巴$中打开智能手环的参数​,完成,好的,阿里巴巴,打开,在阿里巴巴中打开<搜索内容>的参数,,,,,,,,,,,,,,,
单轮-单任务,1,方便帮我打开阿里巴巴折叠桌椅的详情​吗,在$阿里巴巴$中打开折叠桌椅的详情​,完成,好的,阿里巴巴,打开,在阿里巴巴中打开<搜索内容>的详情,,,,,,,,,,,,,,,
单轮-单任务,1,太慢了啊，赶紧帮我查下阿里巴巴蓝牙耳机送达到深圳市南山区科技园科苑路8号的时间​,在$阿里巴巴$中查看蓝牙耳机送达深圳市南山区科技园科苑路8号的时间​,完成,好的,阿里巴巴,搜索,在阿里巴巴中查看<搜索内容>送达<地址>的时间,,,,,,,,,,,,,,,
单轮-单任务,1,悠悠，可以帮我添加3袋三只松鼠每日坚果到天猫的购物车中吗,在$天猫$中把3袋三只松鼠每日坚果加入购物车,完成,好的,天猫,购物车,在天猫中加入购物车<数量>的<搜索内容>,,,,,,,,,,,,,,,
单轮-单任务,1,天气冷了，可以帮我把M码的优衣库摇粒绒外套添加到天猫的购物车中吗,在$天猫$中把M码的优衣库摇粒绒外套加入购物车,完成,好的,天猫,购物车,在天猫中加入购物车<规格>的<搜索内容>,,,,,,,,,,,,,,,
单轮-单任务,1,麻烦帮把戴森吹风机添加到天猫的购物车中,在$天猫$中把戴森吹风机加入购物车,完成,好的,天猫,购物车,在天猫中加入购物车<搜索内容>,,,,,,,,,,,,,,,
单轮-单任务,1,在天猫中加入购物车XL码3件的太平鸟羽绒服送至上海市浦东新区张江高科技园区博云路2号,在$天猫$中把加入购物车的3件XL码太平鸟羽绒服送至上海市浦东新区张江高科技园区博云路2号,完成,好的,天猫,购物车,在天猫中加入购物车<规格><数量>的<搜索内容>送至<地址>,,,,,,,,,,,,,,,
单轮-单任务,1,在天猫中加入购物车九阳全自动豆浆机送至北京市朝阳区建国路88号,在$天猫$中把加入购物车的九阳全自动豆浆机送至北京市朝阳区建国路88号,完成,好的,天猫,购物车,在天猫中加入购物车<搜索内容>送至<地址>,,,,,,,,,,,,,,,
单轮-单任务,1,帮我在阿里巴巴下单下办公文件柜​,在$阿里巴巴$中下单办公文件柜​,完成,好的,阿里巴巴,下单,在阿里巴巴中下单<搜索内容>,,,,,,,,,,,,,,,
单轮-单任务,1,悠悠，在阿里巴巴中下单20cm的毛绒玩具,在$阿里巴巴$中下单20cm的毛绒玩具​,完成,好的,阿里巴巴,下单,在阿里巴巴中下单<规格>的<搜索内容>,,,,,,,,,,,,,,,
单轮-单任务,1,帮我在阿里巴巴下单50双一次性手套​,在$阿里巴巴$中下单50双一次性手套​,完成,好的,阿里巴巴,下单,在阿里巴巴中下单<数量>的<搜索内容>,,,,,,,,,,,,,,,
